netflix,https://www.instagram.com/netflix,https://www.instagram.com/reel/CsEftLZuagL/,?úfart catcher??is legit georgian slang i swear,reel,2023-05-10 13:00,169530,0.37,0.51212,381,-0.46,169149,0.37,,831053,914158
netflix,https://www.instagram.com/netflix,https://www.instagram.com/reel/Cr1JuBDup20/,this was the moment in queen charlotte where i knew this was a phone-down type of show. i was right.NOW STREAMING!,reel,2023-05-04 14:00,169295,0.36,0.51141,725,0.01,168570,0.37,,951587,1046745
netflix,https://www.instagram.com/netflix,https://www.instagram.com/reel/CsePq2ouh7D/,sorry anna minyeong and anthony ??but the siblings take it! #xokitty,reel,2023-05-20 13:00,169289,0.36,0.51139,309,-0.56,168980,0.37,,805055,885561
netflix,https://www.instagram.com/netflix,https://www.instagram.com/reel/CsB64knuMmp/,(i totally didn?ôt make this just as a cheat sheet for scenes i want to go back and rewatch),reel,2023-05-09 13:00,169220,0.36,0.51649,681,-0.05,168539,0.37,,935357,1028893
netflix,https://www.instagram.com/netflix,https://www.instagram.com/reel/C2SysKnu9iZ/,DO NOT lift her charger or she?ôll go la jefa on you. LIFT is now streaming and GRISELDA premieres january 25,reel,2024-01-19 15:00,169152,0.36,0.51098,1735,1.42,167417,0.36,,967149,1063864
netflix,https://www.instagram.com/netflix,https://www.instagram.com/reel/CxLON6tMMx4/,wes anderson takes you into the world of THE WONDERFUL STORY OF HENRY SUGAR. premiering september 27.,reel,2023-09-14 11:00,167245,0.35,0.50522,441,-0.38,166804,0.35,,641222,705344
netflix,https://www.instagram.com/netflix,https://www.instagram.com/p/CxLpjJBsbH3/,friendly reminder to apply sunscreen bbs,CAROUSEL_ALBUM,2023-09-14 15:00,166070,0.34,0.50167,208,-0.7,165862,0.34,,529800,582780
netflix,https://www.instagram.com/netflix,https://www.instagram.com/reel/CqYgfWAgFRF/,Mission Accepted: The Night Agent Season 2. Coming 2024 ?í•,reel,2023-03-29 14:31,165627,0.33,0.50033,3865,4.39,161762,0.31,,1243738,1368112
netflix,https://www.instagram.com/netflix,https://www.instagram.com/reel/Cy6f8utuTjw/,pls enjoy these LIFE ON OUR PLANET bloopers from the one and only morgan f***ing freeman,reel,2023-10-27 15:36,165434,0.33,0.49975,629,-0.12,164805,0.34,,627341,690076
netflix,https://www.instagram.com/netflix,https://www.instagram.com/p/CpffAuVsBkV/,On to Round 2. Full Swing is coming back for another season.,IMAGE,2023-03-07 10:00,164484,0.33,0.49698,887,0.23,163597,0.33,,904750,995226
netflix,https://www.instagram.com/netflix,https://www.instagram.com/reel/CsC0daoAcFK/,Parenting is a mother! In just 3 days we?ôll know their story. THE MOTHER comes out May 12 ?®Only on Netflix??reel,2023-05-09 21:26,164475,0.33,0.49685,1320,0.84,163155,0.32,,1009300,1110230,
netflix,https://www.instagram.com/netflix,https://www.instagram.com/reel/Cu-qD24AFb-/,welcome to the great pirate era. ?è¥?ç‚ò†Ô∏èthe legendary quest to discover the ONE PIECE sets sail august 31,reel,2023-07-21 21:00,164299,0.32,0.49632,1779,1.48,162520,0.32,,848762,933639
netflix,https://www.instagram.com/netflix,https://www.instagram.com/reel/CtkL0dLAMeZ/,LIVE FROM BRAZIL! maitreyiramakrishnan gives a tour of #TUDUM,reel,2023-06-16 16:56,163821,0.32,0.49488,507,-0.29,163314,0.32,,845590,930150
netflix,https://www.instagram.com/netflix,https://www.instagram.com/p/C3wKZqZxSTN/,Billie Eilish signed Melissa McCarthy?ôs face #sagawards2018,CAROUSEL_ALBUM,2024-02-24 20:46,163220,0.32,0.49306,240,-0.66,162980,0.32,,755859,831445
netflix,https://www.instagram.com/netflix,https://www.instagram.com/reel/Cra7xC_ge1M/,HEARTSTOPPER SEASON 2 IS COMING AUGUST 3RD ?çÇ ?çÇ ?çÇ,reel,2023-04-24 10:00,163016,0.31,0.49244,1227,0.71,161789,0.31,,921413,1013554
netflix,https://www.instagram.com/netflix,https://www.instagram.com/p/C2z5AFEOYFQ/,yesss sensei! here?ôs a behind the scenes peek of the filming of the biggest baddest and final season of COBRA KAI,IMAGE,2024-02-01 11:00,162955,0.31,0.49226,684,-0.04,162271,0.32,,730825,803908
netflix,https://www.instagram.com/netflix,https://www.instagram.com/reel/CufFKbBAvBw/,they need to invent a word stronger than mother for poornagraphy(?é•: The Out-Laws),reel,2023-07-09 14:00,162615,0.31,0.49123,751,0.04,161864,0.31,,696079,765687
netflix,https://www.instagram.com/netflix,https://www.instagram.com/reel/CpaOjN-PMwg/,JD and Rudy doing ASMR is as chaotic as I expected,reel,2023-03-05 9:00,162138,0.31,0.48989,466,-0.34,161672,0.31,,850341,935375
netflix,https://www.instagram.com/netflix,https://www.instagram.com/reel/CsmQoCIMyme/,the xo kitty cast reacts to kitty?ôs dream about yuri!!!!,reel,2023-05-23 16:00,162022,0.31,0.48944,863,0.2,161159,0.31,,971318,1068450
netflix,https://www.instagram.com/netflix,https://www.instagram.com/reel/CtT3sy2AO8j/,NeverHaveIEver?ôs MaitreyiRamakrishnan and LeeRodriguez look at what the fans have had to say about the show and what it means to them,reel,2023-06-10 9:00,160178,0.29,0.48387,380,-0.46,159798,0.3,,787085,865793
netflix,https://www.instagram.com/netflix,https://www.instagram.com/reel/C2P7bDBuFkR/,you have never seen sofia vergara like this!,reel,2024-01-18 12:30,160089,0.29,0.4836,1324,0.84,158765,0.29,,885934,974528
netflix,https://www.instagram.com/netflix,https://www.instagram.com/reel/C0b-K0pxEfG/,need to know how many takes this took jennifer.garner ememyers?ì∫: family switch,reel,2023-12-04 11:00,159972,0.29,0.48325,495,-0.3,159477,0.29,,780893,858982
netflix,https://www.instagram.com/netflix,https://www.instagram.com/p/CsRg_CaLmF3/,high non-negotiable standards >>>>,IMAGE,2023-05-15 15:00,159799,0.29,0.48273,403,-0.43,159396,0.29,,704268,774695
netflix,https://www.instagram.com/netflix,https://www.instagram.com/p/Cyvm_aILD36/,happy mondeeee?ì∫: the wolf of wall street,CAROUSEL_ALBUM,2023-10-23 10:00,159724,0.29,0.4825,262,-0.63,159462,0.29,,499776,549753
netflix,https://www.instagram.com/netflix,https://www.instagram.com/reel/CrtcrHOp6MF/,From the creators of Monster comes the next chilling installment of the anthology series:Monsters: The Lyle and Erik Menendez Story.,reel,2023-05-01 15:00,159698,0.29,0.48242,785,0.09,158913,0.29,,934115,1027526
netflix,https://www.instagram.com/netflix,https://www.instagram.com/reel/Cu8Fn6SgtDn/,a paleoanthropologist has found the world?ôs oldest graveyard ??and it?ôs not human.UNKNOWN: Cave of Bones now on netflix,reel,2023-07-20 20:15,159490,0.29,0.48179,587,-0.18,158903,0.29,,712361,783597
netflix,https://www.instagram.com/netflix,https://www.instagram.com/p/CtXGzZWumff/,?®stress??CAROUSEL_ALBUM,2023-06-11 15:00,158879,0.28,0.47995,405,-0.43,158474,0.28,,822277,904504,
netflix,https://www.instagram.com/netflix,https://www.instagram.com/p/C1DVK6isWI8/,enough is enough,IMAGE,2023-12-19 19:00,158681,0.28,0.47935,781,0.08,157900,0.28,,745616,820178
netflix,https://www.instagram.com/netflix,https://www.instagram.com/p/C1aaYztueph/,i would literally do anything for them?ì∫: pok√©mon concierge,CAROUSEL_ALBUM,2023-12-28 17:00,158624,0.28,0.47918,585,-0.18,158039,0.28,,829848,912832
netflix,https://www.instagram.com/netflix,https://www.instagram.com/p/CqnlRl2uhRX/,you know peter sutherland and rose larkin now say hello to gabrielbasso and lucianebuchanan ?ì∏ bymaxhemphilll,CAROUSEL_ALBUM,2023-04-04 11:00,158595,0.28,0.47909,629,-0.12,157966,0.28,,812986,894285
netflix,https://www.instagram.com/netflix,https://www.instagram.com/reel/CsrcLdROu4J/,a perfect moment from every angle ?íñ?íñ?íñ?íñ,reel,2023-05-25 16:00,158516,0.28,0.47885,620,-0.13,157896,0.28,,871059,958165
netflix,https://www.instagram.com/netflix,https://www.instagram.com/reel/C2xIM9wOFXg/,she?ôs sooo right it was all monster coded after this scene?ì∫: griselda,reel,2024-01-31 10:00,158052,0.27,0.47745,1385,0.93,156667,0.27,,884780,973258
netflix,https://www.instagram.com/netflix,https://www.instagram.com/reel/CuzX986gBz2/,POV: words of affirmation is not your love language.,reel,2023-07-17 11:00,157651,0.27,0.47624,406,-0.43,157245,0.27,,798800,878681
netflix,https://www.instagram.com/netflix,https://www.instagram.com/p/C17SD8HMcGX/,1st slide: NAAAUUUURRRRRRRRR!!2nd slide: YEEEEEUUHHHH!!,CAROUSEL_ALBUM,2024-01-10 12:00,157199,0.27,0.47487,340,-0.52,156859,0.27,,753992,829391
netflix,https://www.instagram.com/netflix,https://www.instagram.com/p/Cr7XRexOntI/,where u at,IMAGE,2023-05-07 13:00,157150,0.27,0.47472,339,-0.52,156811,0.27,,673897,741287
netflix,https://www.instagram.com/netflix,https://www.instagram.com/reel/Csv1v1gtYIw/,crying over this moment when kitty tells her dad she has feelings for yuri because he?ôs literally half asleep and doesn?ôt hesitate to be supportive ?íû,reel,2023-05-27 9:00,156970,0.26,0.47418,900,0.25,156070,0.27,,962940,1059234
netflix,https://www.instagram.com/netflix,https://www.instagram.com/reel/CsKcneyAEz_/,tiny mic at the XO KITTY premiere last night <3333,reel,2023-05-12 20:30,156463,0.26,0.47265,606,-0.15,155857,0.26,,857746,943520
netflix,https://www.instagram.com/netflix,https://www.instagram.com/p/C3IYhZ7pYjn/,this is the only way i want to be kissed ever?ì∫: one day now streaming,CAROUSEL_ALBUM,2024-02-09 10:00,155769,0.26,0.47055,1137,0.58,154632,0.25,,944202,1038622
netflix,https://www.instagram.com/netflix,https://www.instagram.com/p/CzOngPcLyyv/,the eagle has landed ??,CAROUSEL_ALBUM,2023-11-04 11:01,155189,0.25,0.4688,470,-0.34,154719,0.25,,767476,844224
netflix,https://www.instagram.com/netflix,https://www.instagram.com/reel/Cs_0zm-OGMp/,officially in love with thisisgiakim,reel,2023-06-02 14:00,154873,0.25,0.46785,457,-0.36,154416,0.25,,791510,870661
netflix,https://www.instagram.com/netflix,https://www.instagram.com/reel/C2QMGZ4ud8H/,hip hop is a lifestyle. RHYTHM + FLOW season 2 is coming back with judges dj khaled latto and ludacris,reel,2024-01-18 15:00,154643,0.25,0.46715,2511,2.5,152132,0.23,,965145,1061659
netflix,https://www.instagram.com/netflix,https://www.instagram.com/p/C4BCBB9JCJT/,she was a lawyer??he was a sandwich. and i am freaking out bc SEX AND THE CITY the complete series is streaming in the us starting april 1,CAROUSEL_ALBUM,2024-03-02 10:00,154373,0.24,0.46633,1030,0.43,153343,0.24,,1524580,1677038
netflix,https://www.instagram.com/netflix,https://www.instagram.com/p/Cqf2422v1gw/,jennifer aniston and adam sandler are my mom and dad irl,CAROUSEL_ALBUM,2023-04-01 11:00,154062,0.24,0.4654,342,-0.52,153720,0.25,,731455,804600
netflix,https://www.instagram.com/netflix,https://www.instagram.com/p/C3wHWCSxi3D/,DEVIL WEARS PRADA REUNION at the SAG Awards! #SAGAwards,IMAGE,2024-02-24 20:19,153950,0.24,0.46506,242,-0.66,153708,0.25,,606495,667145
netflix,https://www.instagram.com/netflix,https://www.instagram.com/reel/C3k2wNEOnpc/,be careful who you wish for. IRISH WISH premieres march 15,reel,2024-02-20 12:00,153566,0.24,0.4639,2271,2.16,151295,0.23,,972968,1070265
netflix,https://www.instagram.com/netflix,https://www.instagram.com/reel/Cx5RvozuPze/,there is no going back to normal.julia roberts mahershala ali myha?ôla ethan hawke & kevin bacon star in the apocalyptic thriller LEAVE THE WORLD BEHIND coming to Netflix december 8,reel,2023-10-02 8:00,153114,0.23,0.46253,719,0,152395,0.24,,643435,707779
netflix,https://www.instagram.com/netflix,https://www.instagram.com/p/C2adrhyuaUZ/,the first movie to ever star the one and only britney spears has never been available on streaming... but thats about to change!so thrilled to announce that CROSSROADS will finally be available on netflix ?ö® GLOBALLY ?ö® starting february 15,IMAGE,2024-01-22 14:00,152337,0.23,0.46018,3541,3.93,148796,0.21,,873916,961308
netflix,https://www.instagram.com/netflix,https://www.instagram.com/reel/Cyv7q2TxBi8/,chris evans and emily blunt?ôs on-screen chemistry is everything. PAIN HUSTLERS coming friday!,reel,2023-10-23 13:00,152253,0.23,0.45993,467,-0.34,151786,0.23,,546312,600943
netflix,https://www.instagram.com/netflix,https://www.instagram.com/reel/C1L9e9ENe3S/,gonna learn this over break bc why not?ì∫: community,reel,2023-12-23 11:00,151667,0.22,0.45816,853,0.18,150814,0.22,,836537,920190
netflix,https://www.instagram.com/netflix,https://www.instagram.com/reel/CqOQ0tMJXzI/,the opening scene to THE NIGHT AGENT will have you HOOKED,reel,2023-03-25 15:00,151313,0.22,0.45709,1160,0.61,150153,0.22,,933282,1026610
netflix,https://www.instagram.com/netflix,https://www.instagram.com/p/C2uveUNs9b7/,watching GRISELDA for the plot,CAROUSEL_ALBUM,2024-01-30 11:00,150386,0.21,0.45429,1329,0.85,149057,0.21,,880564,968620
netflix,https://www.instagram.com/netflix,https://www.instagram.com/reel/CxdQVTutDKu/,the iconic crying kid meme is back and hes now a spy kids fan!!! SPY KIDS: ARMAGEDDON premieres tomorrow!,reel,2023-09-21 12:00,149130,0.2,0.4505,370,-0.48,148760,0.21,,574239,631663
netflix,https://www.instagram.com/netflix,https://www.instagram.com/p/Cxn8eVvR7_o/,?òµ?çüí?CAROUSEL_ALBUM,2023-09-25 15:00,149111,0.2,0.45044,183,-0.74,148928,0.21,,488490,537338,
netflix,https://www.instagram.com/netflix,https://www.instagram.com/p/C1YT5V8t8-s/,need every fit maya hawke wears as jamie bernstein in MAESTRO,CAROUSEL_ALBUM,2023-12-28 13:00,148732,0.2,0.4493,338,-0.52,148394,0.2,,723213,795534
netflix,https://www.instagram.com/netflix,https://www.instagram.com/p/CvckqziIChx/,who are these heroes? i can?ôt tell with those masks on,CAROUSEL_ALBUM,2023-08-02 11:00,147273,0.19,0.44489,351,-0.51,146922,0.19,,771370,848507
netflix,https://www.instagram.com/netflix,https://www.instagram.com/reel/CtmxVooosG1/,His plan: to steal ??4 million ??in one afternoon. From the world of Money Heist/La casa de papel comes BERLIN. Watch the first teaser #TUDUM,reel,2023-06-17 17:00,146533,0.18,0.44265,423,-0.4,146110,0.18,,745527,820080
netflix,https://www.instagram.com/netflix,https://www.instagram.com/p/CxdehXMRVhp/,nami is stronger than me bc i would?ôve been swooning,IMAGE,2023-09-21 14:00,146450,0.18,0.4424,275,-0.61,146175,0.18,,454724,500196
netflix,https://www.instagram.com/netflix,https://www.instagram.com/p/CvnTUO0O-j0/,monday eve,CAROUSEL_ALBUM,2023-08-06 15:00,146417,0.18,0.4423,343,-0.52,146074,0.18,,764143,840557
netflix,https://www.instagram.com/netflix,https://www.instagram.com/p/C3VQh_FPFyA/,happy valentines day leowoodall,CAROUSEL_ALBUM,2024-02-14 10:00,146340,0.18,0.44207,400,-0.44,145940,0.18,,723052,795357
netflix,https://www.instagram.com/netflix,https://www.instagram.com/reel/CtHcThvOsZ9/,??ICONIC NEVER HAVE I EVER MOMENTS ??reel,2023-06-05 13:00,146116,0.18,0.44139,496,-0.3,145620,0.18,,769355,846291,
netflix,https://www.instagram.com/netflix,https://www.instagram.com/reel/CzL06xRtJ-z/,this one is for the horse girls?ì∫: unicorn academy now streaming,reel,2023-11-03 9:00,146049,0.18,0.44119,468,-0.34,145581,0.18,,699898,769887
netflix,https://www.instagram.com/netflix,https://www.instagram.com/reel/CukF5IVA-vJ/,ilysmnails x NIMONA ?íÖ,reel,2023-07-11 13:00,145946,0.18,0.44088,1943,1.71,144003,0.17,,914772,1006249
netflix,https://www.instagram.com/netflix,https://www.instagram.com/p/Cz_c_v3Rp6A/,be honest with me.. how long would you hold a squat for 4.56 million dollars?,IMAGE,2023-11-23 13:00,145639,0.17,0.43995,1236,0.72,144403,0.17,,759371,835308
netflix,https://www.instagram.com/netflix,https://www.instagram.com/reel/CxQlpN5MyPl/,Bringing the Lord of the Coast to life was a MASSIVE undertaking. ?åä #OnePieceNetflix #OnePieceLiveAction,reel,2023-09-16 12:30,145210,0.17,0.43866,480,-0.33,144730,0.17,,629654,692620
netflix,https://www.instagram.com/netflix,https://www.instagram.com/reel/CsrOd5iMVlO/,in sang heon we trust,reel,2023-05-25 14:00,144788,0.17,0.43738,373,-0.47,144415,0.17,,727121,799834
netflix,https://www.instagram.com/netflix,https://www.instagram.com/p/CzHUfhMxevK/,based on the pulitzer prize winning novel ALL THE LIGHT WE CANNOT SEE streams on netflix in 12 hours!,CAROUSEL_ALBUM,2023-11-01 15:00,144569,0.16,0.43672,333,-0.53,144236,0.17,,691411,760553
netflix,https://www.instagram.com/netflix,https://www.instagram.com/p/CtZW_AFOBLI/,Your favorite stars are inviting you to  #TUDUM: A Global Fan Event live from Brazil! Prepare yourself for a day filled with sneak peeks and major surprises when the global fan event streams live June 17 on https://www.youtube.com/watch?v=5QoATGUcCcU at 1:30 pm PT.,CAROUSEL_ALBUM,2023-06-12 12:00,144278,0.16,0.43584,888,0.23,143390,0.16,,930555,1023611
netflix,https://www.instagram.com/netflix,https://www.instagram.com/reel/Cr3kafdgcB-/,We asked the Internet what you would do if jlo was your mother and the results were hilarious. The Mother premieres May 12.,reel,2023-05-05 13:00,143992,0.16,0.43498,1595,1.22,142397,0.15,,967066,1063773
netflix,https://www.instagram.com/netflix,https://www.instagram.com/p/C3vb5Uip4MI/,she?ôs the princess of pop AND roadtrips?ì∫: crossroads,CAROUSEL_ALBUM,2024-02-24 14:00,143726,0.16,0.43417,382,-0.46,143344,0.16,,707472,778219
netflix,https://www.instagram.com/netflix,https://www.instagram.com/reel/CpdBG_8M9tD/,sisters gon??sister,reel,2023-03-06 11:00,143678,0.16,0.43411,278,-0.61,143400,0.16,,700292,770322
netflix,https://www.instagram.com/netflix,https://www.instagram.com/reel/CxGGBVtM_F1/,just in time for Halloween comes THE FALL OF THE HOUSE OF USHER a new limited series from creator Mike Flanagan ?ê¶?ç‚¨õ,reel,2023-09-12 11:00,143624,0.16,0.43386,888,0.23,142736,0.16,,662366,728602
netflix,https://www.instagram.com/netflix,https://www.instagram.com/p/CtPtBNIojlA/,?éì CONGRATS ?éì GRADS ?éì,IMAGE,2023-06-08 18:00,143511,0.16,0.43352,357,-0.5,143154,0.16,,625545,688099
netflix,https://www.instagram.com/netflix,https://www.instagram.com/p/CvkTDFONGTw/,^^^^^,CAROUSEL_ALBUM,2023-08-05 11:00,142771,0.15,0.43129,212,-0.7,142559,0.16,,696197,765817
netflix,https://www.instagram.com/netflix,https://www.instagram.com/p/C0KguK9M8aD/,caption it ?ì∫: leo,CAROUSEL_ALBUM,2023-11-27 18:00,142770,0.15,0.43128,460,-0.35,142310,0.15,,712124,783337
netflix,https://www.instagram.com/netflix,https://www.instagram.com/reel/C1PxjEYJ3he/,Bridgerton premiered nearly three years ago ?êù Let us celebrate with a very special gift.,reel,2023-12-24 14:00,142533,0.15,0.43057,267,-0.62,142266,0.15,,652136,717349
netflix,https://www.instagram.com/netflix,https://www.instagram.com/p/C0hsWDMvACb/,LOOK AT THEM!!!?íì?§Ô∏è?íò?íû?©µ?íú?£Ô∏è?íì?íö?íõ?£Ô∏è?íñ?ß°?íì?©∑,CAROUSEL_ALBUM,2023-12-06 17:00,142123,0.14,0.42933,602,-0.16,141521,0.15,,763815,840197
netflix,https://www.instagram.com/netflix,https://www.instagram.com/p/Cswe7r1rUxL/,?òÉ,CAROUSEL_ALBUM,2023-05-27 15:00,142005,0.14,0.42897,423,-0.4,141582,0.15,,762671,838938
netflix,https://www.instagram.com/netflix,https://www.instagram.com/reel/C3DIByxsmvz/,wilmon endgame? the final season of YOUNG ROYALS is coming march 11 with episodes 1-5 and the series finale on march 18,reel,2024-02-07 9:01,141804,0.14,0.42836,805,0.12,140999,0.14,,772198,849417
netflix,https://www.instagram.com/netflix,https://www.instagram.com/reel/CtALIH-AuC3/,fan questions at the NEVER HAVE I EVER premiere ?íï ?íï ?íï ?íï,reel,2023-06-02 17:30,141648,0.14,0.4279,399,-0.44,141249,0.14,,718170,789987
netflix,https://www.instagram.com/netflix,https://www.instagram.com/reel/CwQaRMYArgw/,zack snyder?ôs REBEL MOON ??a two-part movie event ??begins this decemberpart one: A CHILD OF FIRE - december 22 2023part two: THE SCARGIVER - april 19 2024,reel,2023-08-22 14:28,141494,0.14,0.42743,940,0.31,140554,0.14,,814778,896255
netflix,https://www.instagram.com/netflix,https://www.instagram.com/reel/C0M9xsIRn1D/,why am i singing along to the bread makes you fat song ?ò≠,reel,2023-11-28 16:00,141481,0.14,0.42739,461,-0.35,141020,0.14,,640935,705028
netflix,https://www.instagram.com/netflix,https://www.instagram.com/reel/CsjSTsuu8oB/,lol,reel,2023-05-22 12:00,141235,0.14,0.42665,307,-0.57,140928,0.14,,688795,757674
netflix,https://www.instagram.com/netflix,https://www.instagram.com/reel/C0XZgUmxd-m/,it?ôs the details for me. like they really bleeped her swearing just like the movie ?ò≠,reel,2023-12-02 17:00,141227,0.14,0.42662,539,-0.24,140688,0.14,,714971,786468
netflix,https://www.instagram.com/netflix,https://www.instagram.com/p/Cw0Oj5OODyD/,your pain is their payday. PAIN HUSTLERS drops october 27.,CAROUSEL_ALBUM,2023-09-05 12:00,140836,0.13,0.42544,265,-0.63,140571,0.14,,521186,573305
netflix,https://www.instagram.com/netflix,https://www.instagram.com/reel/CtkalWyJ-cM/,#TUDUM IS HAPPENING TOMORROW! CLICK THE LINK IN BIO TO WATCH LIVE FROM BRAZIL,reel,2023-06-16 19:05,140775,0.13,0.42526,221,-0.69,140554,0.14,,653356,718691
netflix,https://www.instagram.com/netflix,https://www.instagram.com/reel/CrBcJDJrKSP/,a lil BTS peek behind the curtain on The Night Agent ?í• ?í• ?í•,reel,2023-04-14 12:00,140539,0.13,0.42455,447,-0.37,140092,0.13,,668845,735729
netflix,https://www.instagram.com/netflix,https://www.instagram.com/p/Cw3SSoGOcLt/,swipe to unite the straw hats >>>,CAROUSEL_ALBUM,2023-09-06 16:30,140324,0.13,0.4239,332,-0.53,139992,0.13,,559884,615872
netflix,https://www.instagram.com/netflix,https://www.instagram.com/p/CzJkrCFNB1n/,selling sunset season 7 premieres tomorrow!and on november 15 at 6pm PT/9pm ET get ready for the selling sunset reunion event you WON?ôT want to miss hosted by tan france!,CAROUSEL_ALBUM,2023-11-02 12:00,140261,0.13,0.42371,500,-0.3,139761,0.13,,710086,781095
netflix,https://www.instagram.com/netflix,https://www.instagram.com/p/CukrO3HO-_4/,sabrina carpenter was on ORANGE IS THE NEW BLACK?! YUP!here some other famous faces you might have forgotten guest starred on the show.,CAROUSEL_ALBUM,2023-07-11 18:00,140188,0.13,0.42349,403,-0.43,139785,0.13,,755677,831245
netflix,https://www.instagram.com/netflix,https://www.instagram.com/reel/Csqy-0QA06S/,i?ôm literally french now,reel,2023-05-25 10:00,139866,0.13,0.42251,561,-0.21,139305,0.13,,774054,851459
netflix,https://www.instagram.com/netflix,https://www.instagram.com/p/Cz1PoeSRQId/,all they feel is ?®sparks??CAROUSEL_ALBUM,2023-11-19 13:00,139767,0.13,0.42221,981,0.36,138786,0.12,,815003,896503,
netflix,https://www.instagram.com/netflix,https://www.instagram.com/reel/CtMaiXaAXcm/,there are winners there are champions but there is only one Schwarzenegger. ?í™ARNOLD ??a three part look at the life and career of Arnold Schwarzenegger ??is now streaming.,reel,2023-06-07 12:00,139698,0.13,0.422,1469,1.04,138229,0.12,,897703,987473
netflix,https://www.instagram.com/netflix,https://www.instagram.com/p/CpqG2K2MOjE/,whats ur prob??,CAROUSEL_ALBUM,2023-03-11 13:00,139686,0.13,0.42197,854,0.19,138832,0.12,,949124,1044037
netflix,https://www.instagram.com/netflix,https://www.instagram.com/reel/C0PXRePO-wi/,only want kisses if they look like this,reel,2023-11-29 14:00,139136,0.12,0.42031,5353,6.46,133783,0.08,,993461,1092807
netflix,https://www.instagram.com/netflix,https://www.instagram.com/p/CxV8SmHNHn0/,which straw hat are you ?§™,CAROUSEL_ALBUM,2023-09-18 15:00,139102,0.12,0.4202,636,-0.11,138466,0.12,,624941,687435
netflix,https://www.instagram.com/netflix,https://www.instagram.com/p/C1Z4D5ZudJz/,a place where you can relax and be yourself - here at the pok√©mon resort you can be guaranteed a happy stay! ?èñÔ∏?POK√âMON CONCIERGE is now streaming!,CAROUSEL_ALBUM,2023-12-28 12:00,138704,0.12,0.419,679,-0.05,138025,0.12,,769294,846223
netflix,https://www.instagram.com/netflix,https://www.instagram.com/reel/CwvOteSurKG/,go drink water,reel,2023-09-03 14:00,138570,0.12,0.4186,725,0.01,137845,0.12,,620767,682844
netflix,https://www.instagram.com/netflix,https://www.instagram.com/reel/CsOag7ggt8Q/,Moms you?ôre crushing it. And jlo knows it too. Happy Mother?ôs Day! THE MOTHER is now streaming.,reel,2023-05-14 10:00,138066,0.11,0.41707,1585,1.21,136481,0.11,,941574,1035731
netflix,https://www.instagram.com/netflix,https://www.instagram.com/p/Cp0FYasoOsX/,its time to destroy the Fold -- for good. SHADOW AND BONE sn2 is out TOMORROW!,IMAGE,2023-03-15 11:00,137725,0.11,0.41604,448,-0.37,137277,0.11,,653585,718944
netflix,https://www.instagram.com/netflix,https://www.instagram.com/reel/CstsYBLuT7c/,1 airport 3 love interests. the xo kitty finale is DRAMATIC fr,reel,2023-05-26 13:00,137621,0.11,0.41573,462,-0.35,137159,0.11,,728746,801620
netflix,https://www.instagram.com/netflix,https://www.instagram.com/p/Cu2KeLkMlmA/,leos on july 22 vs july 23,CAROUSEL_ALBUM,2023-07-18 13:00,137602,0.11,0.41567,182,-0.74,137420,0.11,,658153,723969
netflix,https://www.instagram.com/netflix,https://www.instagram.com/reel/CsjBXsdgu-L/,Nobody knows action like Arnold. And nobody hits like Netflix. Don?ôt miss FUBAR only on netflix May 25.,reel,2023-05-22 10:30,137555,0.11,0.41553,1101,0.53,136454,0.11,,954618,1050080
netflix,https://www.instagram.com/netflix,https://www.instagram.com/p/CyLj5QBucUt/,To the house of Usher whose time has come. 4 more days until the new Mike Flanagan horror limited series THE FALL OF THE HOUSE OF USHER!,CAROUSEL_ALBUM,2023-10-09 10:00,137157,0.1,0.41433,532,-0.25,136625,0.11,,567598,624357
netflix,https://www.instagram.com/netflix,https://www.instagram.com/reel/CuCxgTpOW9s/,you are absolutely not ready for poorna jagannathan in THE OUT-LAWS. JULY 7.,reel,2023-06-28 14:00,136954,0.1,0.41372,670,-0.06,136284,0.1,,790069,869076
netflix,https://www.instagram.com/netflix,https://www.instagram.com/p/C3swRNyJ8k9/,and i mean EVERYTHING!! ?ì∫: avatar: the last airbender now streaming,IMAGE,2024-02-23 13:00,136820,0.1,0.41331,971,0.35,135849,0.1,,696001,765601
netflix,https://www.instagram.com/netflix,https://www.instagram.com/reel/CzhSX1axxrZ/,these ONE PIECE bloopers with all your favorite straw hats will have you laughing your heart out #GeekedWeek,reel,2023-11-11 16:45,136336,0.1,0.41185,717,0,135619,0.1,,704877,775364
