netflix,https://www.instagram.com/netflix,https://www.instagram.com/reel/C1UnKLuO7uk/,we need to protect the rebel moon cast at all costs ?§Ô∏è?§Ô∏è?§Ô∏è,reel,2023-12-26 11:01,38572,-0.68,0.11652,345,-0.51,38227,-0.68,,244853,269338
netflix,https://www.instagram.com/netflix,https://www.instagram.com/reel/C0CONF9xlAG/,how every single break up goes?ì∫: leo now streaming,reel,2023-11-24 11:00,38564,-0.68,0.1165,381,-0.46,38183,-0.68,,239978,263975
netflix,https://www.instagram.com/netflix,https://www.instagram.com/reel/C22SkY8OUht/,fear be gone: ORION AND THE DARK is now streaming!,reel,2024-02-02 10:00,38511,-0.68,0.11633,193,-0.73,38318,-0.68,,203666,224033
netflix,https://www.instagram.com/netflix,https://www.instagram.com/reel/C0wuc1mL06k/,Oosa-Oosa-Oosa-Ah! Under Pressure: The U.S. Women?ôs World Cup Team is now streaming!,reel,2023-12-12 13:00,38475,-0.68,0.11623,277,-0.61,38198,-0.68,,227364,250101
netflix,https://www.instagram.com/netflix,https://www.instagram.com/reel/CslnHOrgwK4/,there?ôs a different world behind those doors !!!?é§ Wanda Sykes: I?ôm an Entertainer streaming now,reel,2023-05-23 10:00,38379,-0.68,0.11594,285,-0.6,38094,-0.69,,258750,284625
netflix,https://www.instagram.com/netflix,https://www.instagram.com/reel/CseWdCQAKV2/,no this season of queer eye isn?ôt dramatic why do you ask,reel,2023-05-20 14:00,38227,-0.69,0.11548,257,-0.64,37970,-0.69,,247877,272665
netflix,https://www.instagram.com/netflix,https://www.instagram.com/reel/C1z4zTJRc-5/,not me contemplating the beauty of love and loss for the rest of today ?ò≠?ì∫: good grief,reel,2024-01-07 15:00,38066,-0.69,0.11499,353,-0.5,37713,-0.69,,238899,262789
netflix,https://www.instagram.com/netflix,https://www.instagram.com/reel/CtjjXP0Ogb1/,chrishemsworth breaks down EXTRACTION 2 from A to Z in just 20 seconds ??NOW STREAMING,reel,2023-06-16 11:00,38059,-0.69,0.11497,238,-0.66,37821,-0.69,,237183,260901
netflix,https://www.instagram.com/netflix,https://www.instagram.com/reel/C0Wm1eoMfNi/,that did NOT just happen??üì? squid game: the challenge,reel,2023-12-02 9:00,38019,-0.69,0.11485,1072,0.49,36947,-0.69,,424813,467294
netflix,https://www.instagram.com/netflix,https://www.instagram.com/reel/CpiHUfiNmgR/,First comes love then comes reality.Love is Blind Season 4 premieres March 24,reel,2023-03-08 12:00,38017,-0.69,0.11487,131,-0.81,37886,-0.69,,208407,229247
netflix,https://www.instagram.com/netflix,https://www.instagram.com/reel/CvAaTzsANxq/,it doesn?ôt matter how many times you get knocked down what matters is how many times you get back up.,reel,2023-07-22 13:00,37934,-0.69,0.11459,93,-0.87,37841,-0.69,,190401,209441
netflix,https://www.instagram.com/netflix,https://www.instagram.com/reel/CwkyiU-gyjc/,mickey haller returns! THE LINCOLN LAWYER is coming back for season 3!,reel,2023-08-30 13:00,37909,-0.69,0.11452,335,-0.53,37574,-0.69,,286143,314757
netflix,https://www.instagram.com/netflix,https://www.instagram.com/reel/CzhSN4lJVCX/,prepare for an all-new scott pilgrim adventure and explore the love story of scott and ramona. SCOTT PILGRIM TAKES OFF delves deeper into characters you love. coming to netflix on november 17 ?íë #GeekedWeek,reel,2023-11-11 16:50,37853,-0.69,0.11435,153,-0.78,37700,-0.69,,188356,207191
netflix,https://www.instagram.com/netflix,https://www.instagram.com/p/C0KN8WJrVPC/,i feel seen?ì∫: leo,IMAGE,2023-11-27 14:00,37836,-0.69,0.1143,330,-0.53,37506,-0.69,,198771,218648
netflix,https://www.instagram.com/netflix,https://www.instagram.com/reel/C1SWZfvOjon/,dave is back with his latest special THE DREAMER. launching globally on december 31.,reel,2023-12-25 14:00,37813,-0.69,0.11423,493,-0.31,37320,-0.69,,278827,306710
netflix,https://www.instagram.com/netflix,https://www.instagram.com/p/CzEgkrtM5Oo/,i?ôm being haunted ?éÉ?ì∫: the fall of the house of usher,CAROUSEL_ALBUM,2023-10-31 14:00,37766,-0.69,0.11408,70,-0.9,37696,-0.69,,181120,199233
netflix,https://www.instagram.com/netflix,https://www.instagram.com/reel/CyLxq9DOFI8/,?úhope this email finds you well?ùhow the email finds me:,reel,2023-10-09 12:00,37764,-0.69,0.11408,132,-0.81,37632,-0.69,,190913,210004
netflix,https://www.instagram.com/netflix,https://www.instagram.com/p/CwtJX9TvFv5/,ok im losing my mind who else is obsessed with onepiecenetflix???,CAROUSEL_ALBUM,2023-09-02 18:00,37754,-0.69,0.11405,502,-0.29,37252,-0.69,,369799,406779
netflix,https://www.instagram.com/netflix,https://www.instagram.com/reel/Cq8Lq8KOSmk/,lost count of how many times i?ôve watched this clip of steven yeun singing Incubus,reel,2023-04-12 11:00,37726,-0.69,0.11396,225,-0.68,37501,-0.69,,201164,221280
netflix,https://www.instagram.com/netflix,https://www.instagram.com/reel/C3lPq9IujVn/,omg mauricio talking to his daughters about separating from kyle?! my heart is literally breaking. BUYING BEVERLY HILLS season 2 coming march 22,reel,2024-02-20 15:00,37661,-0.69,0.11377,560,-0.21,37101,-0.69,,286788,315467
netflix,https://www.instagram.com/netflix,https://www.instagram.com/p/C2xGd4KOEXO/,GET EXCITED & GET READY TO SEE WHAT?ôS ?®NEXT ON NETFLIX??COMING TOMORROW!,CAROUSEL_ALBUM,2024-01-31 9:00,37434,-0.69,0.11308,870,0.21,36564,-0.7,,371581,408739
netflix,https://www.instagram.com/netflix,https://www.instagram.com/reel/C067CPVu6oK/,?ó£Ô∏? SAY IT AGAIN?ì∫: madea?ôs family reunion,reel,2023-12-16 12:00,37378,-0.69,0.11291,231,-0.67,37147,-0.69,,211247,232372
netflix,https://www.instagram.com/netflix,https://www.instagram.com/reel/C2NiTxkO2RO/,the similarities between GONE GIRL and this real life case are soo eerie. was it a hoax??? or is it too insane to believe??? AMERICAN NIGHTMARE is now streaming,reel,2024-01-17 13:30,37362,-0.69,0.11286,391,-0.45,36971,-0.69,,244901,269391
netflix,https://www.instagram.com/netflix,https://www.instagram.com/reel/Csyj7NAgeHe/,ok but these impressions were spot on,reel,2023-05-28 11:00,37302,-0.69,0.11268,295,-0.58,37007,-0.69,,257512,283263
netflix,https://www.instagram.com/netflix,https://www.instagram.com/reel/C1fkCDDR_ZF/,nothing more relaxing than the POK√âMON CONCIERGE theme song by mariya takeuchi,reel,2023-12-30 17:00,37285,-0.69,0.11263,249,-0.65,37036,-0.69,,215505,237055
netflix,https://www.instagram.com/netflix,https://www.instagram.com/reel/CqVxe8Fri1_/,going forward i will only be handling breakups in corporate america style ?ò≠,reel,2023-03-28 13:00,37262,-0.69,0.11256,275,-0.61,36987,-0.69,,261892,288081
netflix,https://www.instagram.com/netflix,https://www.instagram.com/reel/Cs6ISoAA4zG/,BLACK MIRROR SEASON 6. JUNE 15.,reel,2023-05-31 9:00,37252,-0.69,0.11253,256,-0.64,36996,-0.69,,243558,267914
netflix,https://www.instagram.com/netflix,https://www.instagram.com/reel/CrbH-8uAOxs/,pressing rewind real quick before season 2 of Sweet Tooth comes out this Friday,reel,2023-04-24 12:00,37121,-0.69,0.11214,289,-0.59,36832,-0.7,,212425,233667
netflix,https://www.instagram.com/netflix,https://www.instagram.com/reel/CqbMCeCgYen/,YOU CANNOT MAKE THIS STUFF UP ?ò≠,reel,2023-03-30 16:00,37118,-0.69,0.11213,531,-0.25,36587,-0.7,,362474,398722
netflix,https://www.instagram.com/netflix,https://www.instagram.com/p/Ctck-T4Mg6L/,damn?¶THEY CLONED TYRONE premieres JULY 21.,IMAGE,2023-06-13 18:00,37090,-0.69,0.11204,239,-0.66,36851,-0.7,,205522,226074
netflix,https://www.instagram.com/netflix,https://www.instagram.com/reel/CuzbSkNgRvn/,a bigger Nailed It! is here! watch 10 amateur bakers go from ?úOh No??to ?úPro??on The Big Nailed It Baking Challenge August 4 only on Netflix ?ç∞ ?ßÅ ??reel,2023-07-17 12:00,37015,-0.7,0.11182,237,-0.66,36778,-0.7,,239915,263906,
netflix,https://www.instagram.com/netflix,https://www.instagram.com/reel/CpoBTjZJW75/,To win 1 million dollars it pays to be a ?úselfish fucking bastard.?ùOutlast ??the thrilling new survival competition series ??is now on Netflix.,reel,2023-03-10 18:00,36942,-0.7,0.1116,679,-0.05,36263,-0.7,,422304,464535
netflix,https://www.instagram.com/netflix,https://www.instagram.com/p/C1fimgHMefL/,haru is sending me?ì∫: pok√©mon concierge,CAROUSEL_ALBUM,2023-12-31 14:00,36890,-0.7,0.11144,245,-0.65,36645,-0.7,,221396,243535
netflix,https://www.instagram.com/netflix,https://www.instagram.com/reel/CqId9R7AvgU/,Heroes aren?ôt born. They answer the call. The Night Agent is Now Streaming,reel,2023-03-23 9:00,36848,-0.7,0.11131,219,-0.69,36629,-0.7,,238052,261858
netflix,https://www.instagram.com/netflix,https://www.instagram.com/reel/CuHfqEJJkGX/,the cast of NIMONA breaks down the film in 15 seconds. NOW ON NETFLIX!!,reel,2023-06-30 10:00,36808,-0.7,0.11119,210,-0.7,36598,-0.7,,222862,245148
netflix,https://www.instagram.com/netflix,https://www.instagram.com/reel/CzwWdthRlZ4/,wait i think i?ôd voluntarily do 5th grade again if leo was my class pet?ì∫: leo premiering november 21,reel,2023-11-17 13:00,36747,-0.7,0.11101,510,-0.28,36237,-0.7,,253961,279357
netflix,https://www.instagram.com/netflix,https://www.instagram.com/reel/C3yVXbzp79S/,information i didn?ôt know i needed until now!!! #SAGAwards,reel,2024-02-25 17:00,36721,-0.7,0.11093,146,-0.79,36575,-0.7,,185225,203747
netflix,https://www.instagram.com/netflix,https://www.instagram.com/reel/Ct1nQAlgh6d/,Proudly thick newly single and ready to take over the world one mo?ôment at a time. Survival of the Thickest comes to Netflix July 13th.,reel,2023-06-23 12:00,36613,-0.7,0.1106,166,-0.76,36447,-0.7,,206835,227518
netflix,https://www.instagram.com/netflix,https://www.instagram.com/reel/CzW54EovugK/,ALL THE LIGHT WE CANNOT SEE is the #1 show on netflix ?íï people around the world are falling in love with the story of werner and marie ?íï,reel,2023-11-07 15:18,36566,-0.7,0.11046,251,-0.64,36315,-0.7,,203576,223934
netflix,https://www.instagram.com/netflix,https://www.instagram.com/reel/Cu2Vg3JschN/,this shoulda went platinum ?ò≠,reel,2023-07-18 14:37,36493,-0.7,0.11024,394,-0.45,36099,-0.7,,295942,325536
netflix,https://www.instagram.com/netflix,https://www.instagram.com/reel/Cpu8fw9AFyP/,?é∂ say my name say my name ?é∂ (i am so sorry),reel,2023-03-13 11:08,36482,-0.7,0.11021,218,-0.69,36264,-0.7,,236134,259747
netflix,https://www.instagram.com/netflix,https://www.instagram.com/reel/Cqn588juaYV/,zack ?íç bliss,reel,2023-04-04 14:00,36426,-0.7,0.11004,168,-0.76,36258,-0.7,,184533,202986
netflix,https://www.instagram.com/netflix,https://www.instagram.com/reel/Cxsi-xrAtVa/,audiences are *falling* for the new mike flanagan horror series THE FALL OF THE HOUSE OF USHER ?òè,reel,2023-09-27 9:01,36405,-0.7,0.10997,91,-0.87,36314,-0.7,,186353,204989
netflix,https://www.instagram.com/netflix,https://www.instagram.com/reel/Cry9s1NJtdS/,gus is my kind of hero,reel,2023-05-03 18:00,36384,-0.7,0.10991,154,-0.78,36230,-0.7,,203957,224352
netflix,https://www.instagram.com/netflix,https://www.instagram.com/reel/C3BFqRQOTno/,it?ôs called godmother math?ì∫: griselda,reel,2024-02-06 14:00,36328,-0.7,0.10974,295,-0.58,36033,-0.7,,218775,240653
netflix,https://www.instagram.com/netflix,https://www.instagram.com/reel/CuUtdvQoPxS/,WHAM! IS NOW STREAMING,reel,2023-07-05 13:12,36328,-0.7,0.10974,202,-0.71,36126,-0.7,,224190,246609
netflix,https://www.instagram.com/netflix,https://www.instagram.com/p/C1j2nsmOFXU/,psyduck is a forever mood?ì∫: pok√©mon concierge,IMAGE,2024-01-01 9:00,36225,-0.7,0.10943,233,-0.67,35992,-0.7,,178867,196754
netflix,https://www.instagram.com/netflix,https://www.instagram.com/reel/CyixqaXuiW_/,from underdog to icon. this is sylvester stallone like you?ôve never seen him before. SLY. november 3.,reel,2023-10-18 11:01,36202,-0.7,0.10936,216,-0.69,35986,-0.7,,207221,227943
netflix,https://www.instagram.com/netflix,https://www.instagram.com/reel/C3ikB8cO9gR/,my life with the players boys?ì∫: players,reel,2024-02-19 14:01,36186,-0.7,0.10931,290,-0.59,35896,-0.7,,217012,238713
netflix,https://www.instagram.com/netflix,https://www.instagram.com/reel/Ct9P5sZA_P5/,pierce brosnan used to be a WHAT ?§ØTHE OUT-LAWS coming July 7,reel,2023-06-26 11:00,36164,-0.7,0.10925,135,-0.81,36029,-0.7,,194404,213844
netflix,https://www.instagram.com/netflix,https://www.instagram.com/reel/Czwze69xr71/,there are some looks that i regret for them...?ì∫: selling sunset reunion,reel,2023-11-17 17:00,36016,-0.7,0.1088,605,-0.15,35411,-0.71,,277352,305088
netflix,https://www.instagram.com/netflix,https://www.instagram.com/reel/CumgBT5AS3A/,me just trying to LIVE MY LIFE!Survival of the Thickest debuts tomorrow,reel,2023-07-12 11:00,35944,-0.7,0.10858,198,-0.72,35746,-0.7,,221074,243181
netflix,https://www.instagram.com/netflix,https://www.instagram.com/p/C4EaFG2vcBV/,BE STILL MY HEART. rafaelnadal #TheNetflixSlam,CAROUSEL_ALBUM,2024-03-03 17:28,35913,-0.7,0.10849,122,-0.82,35791,-0.7,,323372,355710
netflix,https://www.instagram.com/netflix,https://www.instagram.com/reel/Cq-pkcSu7W8/,perfect indeed ?òÉ,reel,2023-04-13 10:00,35880,-0.7,0.10839,145,-0.79,35735,-0.7,,177212,194934
netflix,https://www.instagram.com/netflix,https://www.instagram.com/reel/Cs6WrX6uf6t/,hear me out... what if arnold schwarzenegger was in... every netflix show????,reel,2023-05-31 11:00,35866,-0.7,0.10835,279,-0.61,35587,-0.71,,245992,270591
netflix,https://www.instagram.com/netflix,https://www.instagram.com/p/CvAP6vHvPGF/,got clones on the mind,CAROUSEL_ALBUM,2023-07-22 11:00,35771,-0.71,0.10806,112,-0.84,35659,-0.7,,196107,215718
netflix,https://www.instagram.com/netflix,https://www.instagram.com/reel/CqQ5_7Kpkhd/,what?ôs the best compliment you?ôve ever received???,reel,2023-03-26 17:00,35713,-0.71,0.10788,960,0.33,34753,-0.71,,421901,464091
netflix,https://www.instagram.com/netflix,https://www.instagram.com/reel/CrOWmD6ADHl/,after all these years we surprised the cast of Power Rangers with a wholesome dance tribute ?•π?§Ô∏è,reel,2023-04-19 13:00,35603,-0.71,0.10755,290,-0.59,35313,-0.71,,205782,226361
netflix,https://www.instagram.com/netflix,https://www.instagram.com/reel/C2Savs8scWj/,the way this wasn?ôt even the wildest twist in AMERICAN NIGHTMARE,reel,2024-01-19 11:00,35489,-0.71,0.10721,656,-0.08,34833,-0.71,,299225,329147
netflix,https://www.instagram.com/netflix,https://www.instagram.com/reel/C0Rx3R3vzhW/,RICK IF THEYRE NOT THINKIN ABOUT U I AM!!!,reel,2023-11-30 12:00,35473,-0.71,0.10716,579,-0.19,34894,-0.71,,269597,296557
netflix,https://www.instagram.com/netflix,https://www.instagram.com/reel/CuKHoUjgBtF/,ranking all things pink for NIMONA,reel,2023-07-01 11:00,35462,-0.71,0.10712,196,-0.72,35266,-0.71,,217617,239379
netflix,https://www.instagram.com/netflix,https://www.instagram.com/reel/C2hptUXsd7S/,omw to watch GRISELDA and do nothing else today. NOW STREAMING!!,reel,2024-01-25 9:00,35437,-0.71,0.10705,315,-0.56,35122,-0.71,,219212,241133
netflix,https://www.instagram.com/netflix,https://www.instagram.com/reel/CvNLZNLgUFG/,ROLLER COASTER INTERVIEW WITH JOHN BOYEGA,reel,2023-07-27 12:00,35355,-0.71,0.1068,124,-0.82,35231,-0.71,,191270,210398
netflix,https://www.instagram.com/netflix,https://www.instagram.com/reel/CvSYZEnAPYX/,a THEY CLONED TYRONE masterpiece.?é®: clairesalvo,reel,2023-07-29 12:00,35334,-0.71,0.10674,160,-0.77,35174,-0.71,,204488,224936
netflix,https://www.instagram.com/netflix,https://www.instagram.com/reel/CxqkTE4RzaI/,She went to the game just to see him.Find out how Posh met Becks in BECKHAM ??October 4.,reel,2023-09-26 15:00,35175,-0.71,0.10626,98,-0.86,35077,-0.71,,184023,202426
netflix,https://www.instagram.com/netflix,https://www.instagram.com/reel/CwDaY0KuklL/,bat mitzvah planning is fun for the whole family lol jkYOU ARE SO NOT INVITED TO MY BAT BITZVAH DROPS NEXT WEEK!,reel,2023-08-17 13:00,35115,-0.71,0.10608,86,-0.88,35029,-0.71,,177670,195437
netflix,https://www.instagram.com/netflix,https://www.instagram.com/reel/CzExqxeR43z/,Happy Halloween from Hubie!,reel,2023-10-31 16:00,35091,-0.71,0.106,180,-0.74,34911,-0.71,,192891,212180
netflix,https://www.instagram.com/netflix,https://www.instagram.com/reel/CtmwWiQgyzC/,Never Have I Ever is still celebrating its final season but enjoy this look-back at your favorite nerds. #TUDUM,reel,2023-06-17 17:18,34960,-0.71,0.10561,88,-0.87,34872,-0.71,,173555,190911
netflix,https://www.instagram.com/netflix,https://www.instagram.com/reel/CteuVLLu8xS/,penguins ?çÔ∏è divorce ?çÔ∏è their ?çÔ∏è mate ?çÔ∏è if ?çÔ∏è he ?çÔ∏è doesn?ôt ?çÔ∏è bring ?çÔ∏è food ?çÔ∏èsay less. OUR PLANET II is now streaming!,reel,2023-06-14 14:00,34871,-0.71,0.10534,158,-0.77,34713,-0.71,,196931,216624
netflix,https://www.instagram.com/netflix,https://www.instagram.com/p/C2-Z5-ZuIE4/,this is a shawn levy appreciation post?ì∫: all the light we cannot see now streamingMedia Accessible Description:Slide 1 - Actor Mark Ruffalo speaks directly to camera about his experience working with director Shawn Levy. Clips from the series are shown as Mark recognizes Shawn?ôs strong sense of directing.  Behind-the-scenes footage shows Shawn staging a scene he is about to direct.Slide 2 - Behind-the-scenes footage shows actor Louis Hoffman hugging director Shawn Levy on the set of All the Light We Cannot See. Louis speaks directly to camera about Shawn?ôs love for the actors and characters. More behind-the-scenes footage shows Shawn with actors on set and him behind the camera. Actor Hugh Laurie speaks directly to camera about Shawn?ôs incredible energy on set. Additional behind-the-scenes footage shows Shawn directing a scene that Louis stars in where he runs the rampart wall with explosions in the background.Slide 3 - Behind-the-scenes footage shows director Shawn Levy with actress Aria Mia Loberti on the set of All the Light We Cannot See. Actor Mark Ruffalo speaks directly to camera about how Shawn created a safe and welcoming place on set. Behind-the-scenes footage shows Shawn directing Aria. Aria speaks directly to camera about her wonderful experience with Shawn. Additional behind-the-scenes footage of Aria and Shawn on set is shown.Slide 4 - Behind-the-scenes footage shows actress Aria Mia Loberti on set of All the Light We Cannot See. Aria speaks directly to camera about how director Shawn Levy created space for Aria to fully dive into the role. A clip from the series is show where Aria?ôs character is surprised by an explosion. Additional behind-the-scenes footage shows Shawn directing Aria. Aria speaks directly to camera again to note how Shawn helped guide her. Shawn and Aria hug on set.,CAROUSEL_ALBUM,2024-02-05 13:00,34775,-0.71,0.10505,285,-0.6,34490,-0.71,,218440,240284
netflix,https://www.instagram.com/netflix,https://www.instagram.com/reel/C1igvNPR-LR/,2023 was nuts,reel,2023-12-31 20:30,34708,-0.71,0.10485,349,-0.51,34359,-0.72,,224175,246593
netflix,https://www.instagram.com/netflix,https://www.instagram.com/reel/CwBevlHO1AQ/,laughing is good for your heart of stone ?§≠?§≠?§≠,reel,2023-08-16 19:00,34603,-0.72,0.10453,121,-0.83,34482,-0.71,,189611,208572
netflix,https://www.instagram.com/netflix,https://www.instagram.com/reel/C0uJ-b2uxB3/,golden globe nominee charles melton breaks down his performance as joe yoo in MAY DECEMBER,reel,2023-12-11 13:00,34552,-0.72,0.10438,298,-0.58,34254,-0.72,,216558,238214
netflix,https://www.instagram.com/netflix,https://www.instagram.com/p/Cz41Vxuo35V/,jennifer garner hosting a MAESTRO screening for bradley cooper is (to no surprise) exactly what i needed today?ì∏: getty images,IMAGE,2023-11-20 19:30,34534,-0.72,0.10432,677,-0.05,33857,-0.72,,252013,277214
netflix,https://www.instagram.com/netflix,https://www.instagram.com/reel/CqqbbAhJCf3/,KERI RUSSELL STARS IN THE DIPLOMAT. APRIL 20TH.,reel,2023-04-05 14:00,34506,-0.72,0.10424,127,-0.82,34379,-0.72,,167808,184588
netflix,https://www.instagram.com/netflix,https://www.instagram.com/reel/CzZWDDjRTKD/,the secret cupboard!!!!!!! ?? an adorable moment between director shawn levy and actress nell sutton?ì∫: all the light we cannot seeMedia Accessible Description:Director Shawn Levy dressed in a dark t-shirt and navy pants sits on a park bench beside young actress Nell Sutton dressed in a beige dress with a red graphic tie printed down the middle.,reel,2023-11-08 14:00,34461,-0.72,0.1041,329,-0.54,34132,-0.72,,211469,232616
netflix,https://www.instagram.com/netflix,https://www.instagram.com/reel/CrHBNULO1RY/,name of show?,reel,2023-04-16 16:00,34347,-0.72,0.10376,993,0.38,33354,-0.72,,344686,379155
netflix,https://www.instagram.com/netflix,https://www.instagram.com/reel/Cx6G4PVRuE_/,Meet the dynasty of The Fall of the House of Usher (premieres October 12),reel,2023-10-02 16:00,34319,-0.72,0.10367,113,-0.84,34206,-0.72,,171872,189059
netflix,https://www.instagram.com/netflix,https://www.instagram.com/reel/Ctm77J-PQv-/,Arnold Schwarzenegger just announced at #TUDUM that FUBAR has been renewed for Season 2! And to thank the fans he released this blooper reel,reel,2023-06-17 18:33,34262,-0.72,0.1035,163,-0.77,34099,-0.72,,196143,215758
netflix,https://www.instagram.com/netflix,https://www.instagram.com/reel/C17x1bAu497/,she?ôs my best friend now oliviarodrigo,reel,2024-01-10 16:00,34253,-0.72,0.10347,242,-0.66,34011,-0.72,,197268,216994
netflix,https://www.instagram.com/netflix,https://www.instagram.com/reel/CuCqkXjOFYU/,The cast of One Piece tried snacks from each other?ôs countries while at #TUDUM,reel,2023-06-28 13:00,34186,-0.72,0.10327,162,-0.77,34024,-0.72,,195480,215028
netflix,https://www.instagram.com/netflix,https://www.instagram.com/reel/Cr6ZMd9gPvy/,the cast of sweet tooth are the cutest and funniest so I don?ôt really know who won.,reel,2023-05-06 15:30,34155,-0.72,0.10318,152,-0.78,34003,-0.72,,194078,213486
netflix,https://www.instagram.com/netflix,https://www.instagram.com/reel/Cs4GbWTuZIs/,if you?ôre looking for more singing mermaids meet blixunami from MerPeople.,reel,2023-05-30 14:00,34134,-0.72,0.10311,442,-0.38,33692,-0.72,,296451,326096
netflix,https://www.instagram.com/netflix,https://www.instagram.com/reel/CwgOqK2gKxe/,one thing about moms is that they will always bring the tough love.,reel,2023-08-28 18:00,33984,-0.72,0.10266,439,-0.38,33545,-0.72,,309220,340142
netflix,https://www.instagram.com/netflix,https://www.instagram.com/reel/C3IfZjsN3yz/,don?ôt laugh?ì∫: players premiering february 14,reel,2024-02-09 11:00,33958,-0.72,0.10258,184,-0.74,33774,-0.72,,182848,201133
netflix,https://www.instagram.com/netflix,https://www.instagram.com/p/CrqfLLauSMq/,wrong answers only,IMAGE,2023-04-30 13:00,33841,-0.72,0.10223,287,-0.59,33554,-0.72,,174343,191778
netflix,https://www.instagram.com/netflix,https://www.instagram.com/reel/C0VGtm3JM9a/,lil baby mic on the big ol red carpet! FAMILY SWITCH IS NOW STREAMING,reel,2023-12-01 19:00,33771,-0.72,0.10202,333,-0.53,33438,-0.72,,222133,244346
netflix,https://www.instagram.com/netflix,https://www.instagram.com/reel/C3tWtX9NI7Y/,joey king reveals the job that landed her a SAG Card,reel,2024-02-23 19:00,33696,-0.72,0.10179,162,-0.77,33534,-0.72,,176581,194239
netflix,https://www.instagram.com/netflix,https://www.instagram.com/reel/CsUOdAGJBYr/,yes. i cried.,reel,2023-05-16 16:00,33669,-0.72,0.10171,288,-0.59,33381,-0.72,,240500,264550
netflix,https://www.instagram.com/netflix,https://www.instagram.com/reel/CuIZJ85JhYx/,RIP roach you would have killed the ?òsavage??tiktok dance. THE WITCHER s3 vol. 1 is now streaming,reel,2023-06-30 19:00,33636,-0.72,0.10162,143,-0.8,33493,-0.72,,186619,205281
netflix,https://www.instagram.com/netflix,https://www.instagram.com/reel/CuIZJ85JhYx/,RIP roach you would have killed the ?òsavage??tiktok dance. THE WITCHER s3 vol. 1 is now streaming,reel,2023-06-30 19:00,33548,-0.72,0.10134,142,-0.8,33406,-0.72,,186414,205055
netflix,https://www.instagram.com/netflix,https://www.instagram.com/reel/CuU9WgGgE_y/,All we want in the world is a steady stream of puppies,reel,2023-07-05 15:30,33520,-0.72,0.10126,159,-0.77,33361,-0.72,,197044,216748
netflix,https://www.instagram.com/netflix,https://www.instagram.com/reel/Ct25C1-tK7P/,2 weeks til THE OUT-LAWS!,reel,2023-06-23 11:00,33488,-0.72,0.10116,113,-0.84,33375,-0.72,,176006,193606
netflix,https://www.instagram.com/netflix,https://www.instagram.com/reel/Ct_yAPPg7lP/,okay but what if we?ôre all michael cera?,reel,2023-06-27 11:00,33476,-0.72,0.10113,273,-0.61,33203,-0.72,,230229,253252
netflix,https://www.instagram.com/netflix,https://www.instagram.com/reel/CwYCCD0ge0_/,SEASON 2 OF SELLING THE OC. SEPT 8!,reel,2023-08-25 13:13,33432,-0.72,0.10099,195,-0.72,33237,-0.72,,213060,234366
netflix,https://www.instagram.com/netflix,https://www.instagram.com/reel/C0PePTZukaz/,if there?ôs one thing bryton is gonna do it?ôs push-ups!,reel,2023-11-29 14:30,33239,-0.73,0.10041,706,-0.01,32533,-0.73,,287453,316198
netflix,https://www.instagram.com/netflix,https://www.instagram.com/reel/CqlVFwzOZlU/,tiffany really made me LOL,reel,2023-04-03 14:00,33235,-0.73,0.1004,130,-0.81,33105,-0.73,,163233,179556
netflix,https://www.instagram.com/netflix,https://www.instagram.com/reel/Cs1crX-gqDv/,Everyone?ôs got dealbreakers?îwhat?ôs your biggest one? ?§Ô∏è?íç?íîCheck the verdict of these dealbreakers raised by The Ultimatum: Queer Love now streaming on Netflix + new episodes this Wednesday.,reel,2023-05-29 13:20,33173,-0.73,0.10021,137,-0.8,33036,-0.73,,184714,203185
netflix,https://www.instagram.com/netflix,https://www.instagram.com/reel/C1HcG69M-ra/,The rebellion starts tonight. REBEL MOON - PART ONE: A CHILD OF FIRE premieres in 14 hours.,reel,2023-12-21 8:11,33113,-0.73,0.10003,274,-0.61,32839,-0.73,,204638,225102
netflix,https://www.instagram.com/netflix,https://www.instagram.com/reel/C1VGU3DO7hA/,?úa talented ensemble cast.??MAESTRO starring carey mulligan bradley cooper matt bomer sarah silverman and more is now streaming,reel,2023-12-26 16:00,33025,-0.73,0.09976,265,-0.63,32760,-0.73,,202021,222223
